<?xml version="1.0" ?>
<Order CustomerID="ALFKI" OrderDate="2002-06-11" xmlns:xsi="http://www.w3.org/2001/XMLSchema-instance" xsi:noNamespaceSchemaLocation="Order.xsd">
	<Product ProductID="61">
		<Name>Sirop d'erable</Name>
		<Quantity>5</Quantity>
		<Price>28.50</Price>
		<RequiredDate>2002-08-01</RequiredDate>
	</Product>
	<Product ProductID="69">
		<Name>Gudbrandsdalsost</Name>
		<Quantity>5</Quantity>
		<Price>36.00</Price>
		<RequiredDate>2002-08-01</RequiredDate>
	</Product>
	<Product ProductID="75">
		<Name>Rhonbrau Klosterbier</Name>
		<Quantity>5</Quantity>
		<Price>7.75</Price>
		<RequiredDate>2002-09-01</RequiredDate>
	</Product>
</Order>